{
  "fetch_time": "2026-03-30 18:00:08",
  "data_source": "模拟数据 - 待接入真实API",
  "etf_count": 7,
  "etfs": [
    {
      "ticker": "510300",
      "name": "华泰柏瑞沪深300ETF",
      "index_name": "沪深300",
      "current_nav": "3.842",
      "daily_change": "-0.20%",
      "ytd_return": "+1.41%",
      "volume": "200万手",
      "nav_history": [
        {
          "date": "2026-03-30",
          "price": "3.833",
          "change": "-0.38%"
        },
        {
          "date": "2026-03-29",
          "price": "3.820",
          "change": "-0.27%"
        },
        {
          "date": "2026-03-28",
          "price": "3.831",
          "change": "-0.14%"
        },
        {
          "date": "2026-03-27",
          "price": "3.871",
          "change": "-0.16%"
        },
        {
          "date": "2026-03-26",
          "price": "3.822",
          "change": "+0.39%"
        }
      ],
      "last_updated": "2026-03-30 18:00:08"
    },
    {
      "ticker": "510500",
      "name": "南方中证500ETF",
      "index_name": "中证500",
      "current_nav": "5.610",
      "daily_change": "-0.18%",
      "ytd_return": "+8.78%",
      "volume": "911万手",
      "nav_history": [
        {
          "date": "2026-03-30",
          "price": "5.628",
          "change": "-0.41%"
        },
        {
          "date": "2026-03-29",
          "price": "5.620",
          "change": "+0.22%"
        },
        {
          "date": "2026-03-28",
          "price": "5.645",
          "change": "+0.22%"
        },
        {
          "date": "2026-03-27",
          "price": "5.628",
          "change": "-0.18%"
        },
        {
          "date": "2026-03-26",
          "price": "5.662",
          "change": "-0.37%"
        }
      ],
      "last_updated": "2026-03-30 18:00:08"
    },
    {
      "ticker": "159919",
      "name": "嘉实沪深300ETF",
      "index_name": "沪深300",
      "current_nav": "3.866",
      "daily_change": "+0.56%",
      "ytd_return": "+14.24%",
      "volume": "211万手",
      "nav_history": [
        {
          "date": "2026-03-30",
          "price": "3.833",
          "change": "+0.46%"
        },
        {
          "date": "2026-03-29",
          "price": "3.856",
          "change": "-0.46%"
        },
        {
          "date": "2026-03-28",
          "price": "3.888",
          "change": "-0.45%"
        },
        {
          "date": "2026-03-27",
          "price": "3.841",
          "change": "+0.06%"
        },
        {
          "date": "2026-03-26",
          "price": "3.840",
          "change": "-0.20%"
        }
      ],
      "last_updated": "2026-03-30 18:00:08"
    },
    {
      "ticker": "159915",
      "name": "易方达创业板ETF",
      "index_name": "创业板指",
      "current_nav": "2.158",
      "daily_change": "+0.38%",
      "ytd_return": "+13.41%",
      "volume": "209万手",
      "nav_history": [
        {
          "date": "2026-03-30",
          "price": "2.141",
          "change": "-0.33%"
        },
        {
          "date": "2026-03-29",
          "price": "2.107",
          "change": "+0.33%"
        },
        {
          "date": "2026-03-28",
          "price": "2.173",
          "change": "+0.11%"
        },
        {
          "date": "2026-03-27",
          "price": "2.197",
          "change": "-0.12%"
        },
        {
          "date": "2026-03-26",
          "price": "2.193",
          "change": "+0.11%"
        }
      ],
      "last_updated": "2026-03-30 18:00:08"
    },
    {
      "ticker": "588000",
      "name": "华夏上证科创板50ETF",
      "index_name": "科创50",
      "current_nav": "1.006",
      "daily_change": "+2.69%",
      "ytd_return": "-3.51%",
      "volume": "761万手",
      "nav_history": [
        {
          "date": "2026-03-30",
          "price": "0.944",
          "change": "-0.36%"
        },
        {
          "date": "2026-03-29",
          "price": "0.959",
          "change": "-0.11%"
        },
        {
          "date": "2026-03-28",
          "price": "0.956",
          "change": "+0.23%"
        },
        {
          "date": "2026-03-27",
          "price": "1.021",
          "change": "+0.06%"
        },
        {
          "date": "2026-03-26",
          "price": "0.963",
          "change": "-0.12%"
        }
      ],
      "last_updated": "2026-03-30 18:00:08"
    },
    {
      "ticker": "510050",
      "name": "华夏上证50ETF",
      "index_name": "上证50",
      "current_nav": "2.562",
      "daily_change": "+0.08%",
      "ytd_return": "+14.70%",
      "volume": "684万手",
      "nav_history": [
        {
          "date": "2026-03-30",
          "price": "2.536",
          "change": "+0.01%"
        },
        {
          "date": "2026-03-29",
          "price": "2.598",
          "change": "-0.19%"
        },
        {
          "date": "2026-03-28",
          "price": "2.519",
          "change": "+0.28%"
        },
        {
          "date": "2026-03-27",
          "price": "2.521",
          "change": "+0.00%"
        },
        {
          "date": "2026-03-26",
          "price": "2.589",
          "change": "-0.03%"
        }
      ],
      "last_updated": "2026-03-30 18:00:08"
    },
    {
      "ticker": "512100",
      "name": "南方中证1000ETF",
      "index_name": "中证1000",
      "current_nav": "2.298",
      "daily_change": "-0.54%",
      "ytd_return": "-4.86%",
      "volume": "782万手",
      "nav_history": [
        {
          "date": "2026-03-30",
          "price": "2.282",
          "change": "+0.30%"
        },
        {
          "date": "2026-03-29",
          "price": "2.345",
          "change": "+0.18%"
        },
        {
          "date": "2026-03-28",
          "price": "2.298",
          "change": "+0.01%"
        },
        {
          "date": "2026-03-27",
          "price": "2.328",
          "change": "-0.03%"
        },
        {
          "date": "2026-03-26",
          "price": "2.359",
          "change": "+0.32%"
        }
      ],
      "last_updated": "2026-03-30 18:00:08"
    }
  ]
}
